<?xml version="1.0"?>
<config xmlns:xsi="http://www.w3.org/2001/XMLSchema-instance" xsi:noNamespaceSchemaLocation="source_types.xsd">
    <type name="dropbox" label="Dropbox" modelInstance="Firebear\ImportExport\Model\Source\Type\Dropbox" sortOrder="10">
       <field name="file_path" id="file_path" label="File Path" type="text" required="true" />
       <!-- <field name="access_token" id="access_token" label="Access Token" type="text" required="true" />-->
        <field name="images_on_dropbox" id="images_on_dropbox" label="Import Images From Dropbox" type="checkbox" value="1"/>
        <field name="import_images_file_dir" id="file_import_images_file_dir" label="Images File Directory" type="text" notice="Use relative path to Magento installation, e.g. var/import/images/"/>
    </type>
    <type name="ftp" label="Ftp" modelInstance="Firebear\ImportExport\Model\Source\Type\Ftp" sortOrder="20">
        <field name="file_path" id="file_path" label="File Path" type="text" required="true" />
        <field name="host" id="host" label="Host" type="text" required="true" />
        <field name="port" id="port" label="Port" type="text" required="true" />
        <field name="user" id="username" label="Username" type="text" required="true" />
        <field name="password" id="password" label="Password" type="text" required="true" />
    </type>
    <type name="url" label="Url" modelInstance="Firebear\ImportExport\Model\Source\Type\Url" sortOrder="30">
        <field name="file_path" id="file_path" label="Url" type="text" required="true" />
    </type>

</config>